Question,Fine-tuning,API-based,Similarity Search
What is DevFest 2023?,"DevFest 2023 is an annual tech event organized by GDG communities around the world, featuring tech talks, hands-on sessions, and networking opportunities."," DevFest 2023 is a yearly tech event organized by Google Developers Groups. At DevFest, you can meet other tech enthusiasts, learn new things, and stay updated on the latest tech trends.",DevFest 2023 is a yearly tech event organized by Google Developers Groups.
Who organizes DevFest 2023?,DevFest 2023 is organized by GDG., Google Developers Groups.,Google Developers Groups organizes DevFest 2023
What can attendees do at DevFest 2023?,"At DevFest 2023, attendees can participate in the event by registering online."," Attendees at DevFest 2023 can meet other tech enthusiasts, learn new things, stay updated on the latest tech trends, tackle tech problems, code, create, and compete. They can also get help from mentors with their issues.","At DevFest, you can meet other tech enthusiasts, learn new things, and stay updated on the latest tech trends."
What kind of tech enthusiasts can be found at DevFest 2023?,"At DevFest 2023, you can meet tech enthusiasts, learn new things, and stay up to date with the latest tech trends."," At DevFest 2023, you can meet other tech enthusiasts, learn new things, and stay updated on the latest tech trends.","At DevFest, you can meet other tech enthusiasts, learn new things, and stay updated on the latest tech trends."
What are some of the latest tech trends discussed at DevFest 2023?,"At DevFest 2023, you can expect to learn about the latest tech trends and innovations from experts in the field.", I don't know.,"Sorry, the chatbot cannot answer this question"
What type of event is Devfest'23?,"Devfest'23 is an event that will take place on October 19-21, 2023.", Devfest'23 is a yearly tech event organized by Google Developers Groups. It consists of two parts: a hackathon and online challenges.,"DevFest 2023 is a tech event where you can meet other tech enthusiasts, learn new things, and stay updated on the latest tech trends."
When will the Challenges portion of Devfest'23 take place?,"The Challenges portion of Devfest'23 will take place on October 19th, 2023 on the GDG Challenges platform."," October 19th, 2023",The Challenges portion of Devfest'23 will take place on October 19.
What type of activities will be available during the Hackathon portion of Devfest'23?,"The Hackathon portion of Devfest'23 will include activities such as coding, creating projects, and networking."," During the Hackathon portion of Devfest'23, participants will be able to code, create, and compete. There will also be mentorship sessions available to provide guidance and answer questions.","You can code, create, and compete during the Hackathon portion of DevFest'23."
What is the timeline for Devfest'23?,"Devfest'23 will take place from October 19th to the 21st, 2023.", The timeline for Devfest'23 is October 19th for the Challenges and November 30th for the Hackathon.,"Sorry, the chatbot cannot answer this question"
What is the purpose of Devfest'23?,Devfest'23 is a two-part event that includes Challenges and a Hackathon.," The purpose of Devfest'23 is to provide a platform for tech enthusiasts to meet, learn, and stay updated on the latest tech trends, as well as to participate in challenges and a hackathon.","At DevFest, you can meet other tech enthusiasts, learn new things, and stay updated on the latest tech trends."
What is the date of the Challenges part?,The Challenges part of Event: DevFest 2023 includes two parts: Smart Cities and Cybersecurity.," October 19th, 2023","Sorry, the chatbot cannot answer this question"
How many participants are expected to join the Hackathon?,The Hackathon is expected to have 100 participants., 100 participants are expected to join the Hackathon.,"There is no limit on the number of attendees, although we strongly encourage teams of 5 participants."
What type of skills will be showcased at the Hackathon?,"At the Hackathon, participants will have the opportunity to showcase their skills in coding, creativity, and problem-solving."," Creativity and innovation, clean implementation, and business value.","DevFest 2023 is a tech event where you can meet other tech enthusiasts, learn new things, and stay updated on the latest tech trends.
There will be two parts to DevFest: Challenges happening online on October 19, where you can tackle tech problems and learn, and the second part Hackathon on November 30, where you can code, create, and compete."
What is the format of the Challenges part?,The Challenges part of the event will be divided into two parts: the Hackathon and the Challenges., The Challenges part is an individual competition with a scoring system based on the number and difficulty of solved challenges and the time needed for that. Participants who solve a certain threshold of challenges will receive a certificate.,The Challenges part will have two parts: a hackathon and online challenges.
What is the duration of the Hackathon?,The Hackathon will take place over a period of 10 days.," The Hackathon will take place from October 30th to the 1st December, 2023.","Sorry, the chatbot cannot answer this question"
What type of event is it?,The event is a two-part event consisting of Challenges and a Hackathon.," It is a hackathon and online challenges event with individual competition format and fields such as Web, Mobile, AI, Cyber Security, and Game Dev.",The hackathon is a weekend-long event where participants work on their project ideas with guidance from mentors and experts from the tech industry.
What is the structure of the event?,The event will consist of two parts: a hackathon and online challenges.," The event is divided into two parts: Challenges happening online on October 19, where participants can tackle tech problems and learn, and the Hackathon on November 30, where participants can code, create, and compete. The Challenges part allows an unlimited number of participants to join online, while the Hackathon is expecting 100 participants. Participants have to choose a specific field to participate in.",The event will have two parts: a hackathon and online challenges.
What will be included in the hackathon?,The hackathon will include a certain number of participants.," The hackathon will include online challenges, mentorship sessions, and a theme of Smart Cities with subthemes and a hacker guide provided to participants.",Hackathon prizes include a trip to anywhere in the world
What kind of online challenges will be available?,"The Event Challenges will be available on the GDG Challenges platform starting on October 19th, 2023 and will last for 10 days."," Web, Mobile, AI, Cyber Security, and Game Dev.","Sorry, the chatbot cannot answer this question"
How long will the event last?,"The event will last for 3 days and will include tech talks, workshops, and a hackathon."," The event will last 10 days, from October 19th to November 30th.","The event will last for two days, Friday, March 31st and Saturday, April 1st."
What is the date of the Event Challenges?,"The Event Challenges will take place on October 19th, 2023 on the GDG Challenges platform and will last for 10 days."," October 19th, 2023",Registration are open until the last day before the start of the challenges
Where will the Event Challenges take place?,"The Event Challenges will take place on the GDG Challenges platform from October 19th to the 21st, 2023."," The Event Challenges will take place on the GDG Challenges platform on October 19th, 2023.","Event Challenges will happen online on October 19, where you can tackle tech problems and learn."
How long will the Event Challenges last?,"The Event Challenges will last for 10 days on the GDG Challenges platform from October 19th, 2023.", The Event Challenges will last until October 19th.,Registration for Event Challenges are open until the day before the start of the challenges.
What platform will the Event Challenges be hosted on?,"The Event Challenges will be hosted on the GDG Challenges platform on October 19th, 2023.", The Event Challenges will be hosted on the GDG Challenges platform at gdg.challenges.com.,"Sorry, the chatbot cannot answer this question"
What is the timeline for the Event Challenges?,"The Event Challenges will take place online on October 19th, 2023 on the GDG Challenges platform and will last for 10 days."," The Event Challenges timeline is 10 days, starting on October 19th and ending on November 30th.","Sorry, the chatbot cannot answer this question"
What are the different event challenges available?,The different event challenges available are the Devfest 2023 Challenges.," The event challenges available are Web, Mobile, AI, Cyber Security, and Game Dev.","There are three types of Event Challenges:
- Field selection
- Judging
- Structure"
What fields are covered in the event challenges?,"The fields covered in the event challenges are Web, Mobile, AI, and Cyber Security."," Web, Mobile, AI, Cyber Security, Game Dev.","There are three types of fields in Event Challenges:
Hardware - building a physical device
Software - building software
AI - building an AI"
What is the focus of the Web event challenge?,The focus of the Web event challenge is Web Development., The Web event challenge focuses on web development.,"Sorry, the chatbot cannot answer this question"
What is the focus of the Mobile event challenge?,The focus of the Mobile event challenge is on mobile app development., Creating mobile applications.,"Sorry, the chatbot cannot answer this question"
What is the focus of the AI event challenge?,The focus of the AI event challenge is on Artificial Intelligence., The AI event challenge focuses on developing solutions using artificial intelligence.,The AI event challenge is focused on Artificial Intelligence.
What is the judging criteria for the event challenges?,"The judging criteria for the event challenges will be based on criteria such as creativity, innovation, and clean implementation.", The judging criteria for the event challenges is a scoring system taking into consideration the number and difficulty of solved challenges alongside the time needed for that. Cheating will disqualify the participant in order to preserve the integrity of the competition.,The judging criteria will be a scoring system taking into consideration the number and difficulty of solved challenges alongside the time needed for that Event Challenges.
How is the scoring system determined for the event challenges?,"The scoring system for the Event Challenges is determined by the number and difficulty of solved challenges, with more points awarded for more difficult challenges.", The scoring system takes into consideration the number and difficulty of solved challenges alongside the time needed for that.,The scoring system for the Event Challenges takes into account the number and difficulty of solved challenges alongside the time needed for that Event Challenges.
What factors are taken into consideration when judging the event challenges?,"The judging criteria for the Event Challenges includes criteria such as creativity, innovation, and the quality of the project."," The number and difficulty of solved challenges, the time needed to solve them, and whether or not the participant cheated.",Judging criteria will be a scoring system taking into consideration the number and difficulty of solved challenges alongside the time needed for that Event Challenges
How many challenges must be solved to receive a good score?,"To receive a good score in the Event Challenges, a participant must solve a certain number of challenges."," It depends on the number and difficulty of the challenges, as well as the time needed to solve them.","No, there is no information about how many challenges must be solved to receive a good score."
How much time is allowed for solving the event challenges?,The event challenges are designed to be solved within a specific timeframe., It depends on the number and difficulty of the challenges and the time needed for that.,There is no time restriction for solving the Event Challenges
How do I register for the event challenges?,"You can register for the Event Challenges by visiting the GDG challenges platform and clicking on the ""Register"" button.", You can register for the event challenges by signing up in GDG challenges plateform. Registration is open until the last day before the start of the challenges.,Everyone is welcome to register for the challenges as they will be online Event Challenges
Is there a cost associated with registering for the event challenges?,"No, there is no cost associated with registering for the event challenges."," No, there is no cost associated with registering for the event challenges.",Everyone is welcome to register for the challenges as they will be online Event Challenges
What is the process for registering for the event challenges?,"To register for the Event Challenges, you can do so by visiting the GDG challenges platform and clicking on the ""Register"" button.", You can register for the event challenges by signing up in GDG challenges plateform until the last day before the start of the challenges.,"Sorry, the chatbot cannot answer this question"
Are there any age restrictions for registering for the event challenges?,"No, there are no age restrictions for registering for the event challenges."," No, there are no age restrictions for registering for the event challenges.",Everyone is welcome to register for the challenges as they will be online
Are the event challenges only available online?,"Yes, the Event Challenges are only available online."," Yes, the event challenges are only available online.",Everyone is welcome to register for the challenges as they will be online
What fields are available for participants to choose from?,Participants can choose from the available fields to participate in the Event Challenges.," Web, Mobile, AI, Cyber Security, Game Dev.","Sorry, the chatbot cannot answer this question"
How does a participant select a field to participate in?,A participant must select a field to participate in when registering for an Event Hackathon., A participant can select a field to participate in by signing up in GDG Challenges plateform.,A participant has to choose a specific field to participate in Event Challenges
What criteria must be met in order to participate in a specific field?,"In order to participate in a specific field, you must choose that field in the registration form for the Event Challenges."," Participants must choose a field from the list of available fields (Web, Mobile, AI, Cyber Security, Game Dev) and must not cheat in order to preserve the integrity of the competition.","There are no workshops scheduled for the hackathon, but there will be mentorship sessions, our mentors will be available to assist you whenever you need guidance or have questions during the hackathon."
Are there any restrictions on which fields a participant can choose from?,"Yes, a participant must choose a specific field from the Event Challenges to participate in."," Yes, participants must choose from the fields listed: Web, Mobile, AI, Cyber Security, Game Dev.",A participant has to choose a specific field to participate in Event Challenges
What are the benefits of participating in a specific field?,Participating in a specific field at Event: DevFest will allow you to gain more experience and knowledge in that field., Participating in a specific field can give you access to mentors who are experts in that field and can help you with any issues you may have.,"Sorry, the chatbot cannot answer this question"
What types of events are available on the GDG Challenges platform?,The GDG Challenges platform offers Event Challenges and other Challenges.," Events such as Devfest challenges that have a timeline of 10 days and take place on October 19th, 2023.","GDG Challenges provides two different types of events:
Hackathon: An event where people collaborate intensively on software projects.
Online challenges: A series of programming challenges that can be undertaken remotely."
How can I find Devfest challenges on the GDG Challenges platform?,You can find Devfest challenges on the GDG Challenges platform by visiting gdg.challenges.com., You can find Devfest challenges on the GDG Challenges platform at gdg.challenges.com.,Find Devfest challenges at GDG Challenges plateform: gdg.challenges.com
What is the URL for the GDG Challenges platform?,The URL for the GDG Challenges platform is gdg.challenges.com., gdg.challenges.com,"Sorry, the chatbot cannot answer this question"
What are the benefits of participating in Devfest challenges?,"Participating in Devfest challenges offers the opportunity to learn new skills, gain experience, and stay up to date with the latest technologies."," Participating in Devfest challenges can help you tackle tech problems, learn new things, and stay updated on the latest tech trends.","Sorry, the chatbot cannot answer this question"
What types of challenges are available on the GDG Challenges platform?,The GDG Challenges platform offers Event Challenges and other Challenges., I don't know.,"GDG Challenges offers three types of challenges:
1. Event Challenges: These challenges are usually offered during tech events
2. Online Challenges: These are challenges you can solve at home
3. Hackathons: Solve challenges during a hackathon"
What are the Event Challenges?,"Event Challenges are a set of online challenges that will be hosted on the GDG challenges platform from October 19th to the 21st, 2023."," Event Challenges are a competition format that consists of two parts: a hackathon and online challenges. Participants can compete in fields such as Web, Mobile, AI, Cyber Security, and Game Dev. All participants solving a certain threshold of challenges will receive a certificate.",The Event Challenges will take place online. Participants have to choose a specific field to participate in.
How can I participate in the Event Challenges?,You can participate in the Event Challenges by signing up on the GDG challenges platform., You can participate by signing up in GDG challenges plateform. Everyone is welcome to register for the challenges as they will be online.,Everyone is welcome to register for the challenges as they will be online
What is the GDG Challenges Plateform?,The GDG Challenges Platform is an online event platform where you can participate in the Event Challenges by signing up and submitting your solutions.," The GDG Challenges Plateform is a website where you can find Devfest challenges and sign up to participate. The timeline for the event is 10 days, starting on October 19th, 2023. For additional clarifications and details, you can reach out to GDG through Community server discord and social media platforms.",GDG Challenges is the event challenges platform where you can find Devfest challenges.
What is the process for signing up for the Event Challenges?,"To sign up for the Event Challenges, you can do so by visiting the GDG Challenges platform and creating an account.", You can sign up for the Event Challenges by registering on the GDG challenges platform until the last day before the start of the challenges.,"Sorry, the chatbot cannot answer this question"
What are the benefits of participating in the Event Challenges?,Participating in the Event Challenges offers the opportunity to gain recognition and rewards.," Participants who solve a certain threshold of challenges will receive a certificate, and winners will be announced and mentioned in the event's social media.","The benefits of participating in the Event Challenges are:
- Judging criteria will be a scoring system taking into consideration the number and difficulty of solved challenges alongside the time needed for that.
- There will be mentors to help you with your issues, experts in their fields."
What type of computer components are included in the prizes?,"The prizes for the Event Challenges include computer components, software subscriptions, and hoodies.", I don't know.,"Sorry, the chatbot cannot answer this question"
What software subscriptions are included in the prizes?,"The prizes for the Event Challenges include software subscriptions, hoodies, and t-shirts.", I don't know.,"Sorry, the chatbot cannot answer this question"
What type of hoodies are included in the prizes?,"Bad gateway. {""error"":{""code"":502,""message"":""Bad gateway."",""param"":null,""type"":""cf_bad_gateway""}} 502 {'error': {'code': 502, 'message': 'Bad gateway.', 'param': None, 'type': 'cf_bad_gateway'}} {'Date': 'Wed, 04 Oct 2023 14:50:06 GMT', 'Content-Type': 'application/json', 'Content-Length': '84', 'Connection': 'keep-alive', 'X-Frame-Options': 'SAMEORIGIN', 'Referrer-Policy': 'same-origin', 'Cache-Control': 'private, max-age=0, no-store, no-cache, must-revalidate, post-check=0, pre-check=0', 'Expires': 'Thu, 01 Jan 1970 00:00:01 GMT', 'Server': 'cloudflare', 'CF-RAY': '810e32ac1cc32833-ALG', 'alt-svc': 'h3="":443""; ma=86400'}", I don't know.,"Sorry, the chatbot cannot answer this question"
How many prizes are available for the event challenges?,There will be prizes available for the Event Challenges., It depends on the number of participants.,"Sorry, the chatbot cannot answer this question"
What are the criteria for winning the event challenges?,Winners of the Event Challenges will be determined and announced by GDG., Winners will be determined by a scoring system that takes into consideration the number and difficulty of solved challenges alongside the time needed for that. Cheating will disqualify the participant.,The judging criteria will be a scoring system taking into consideration the number and difficulty of solved challenges alongside the time needed for that Event Challenges.
What are the event challenges?,The event challenges are a competition and the winners will be announced and mentioned in our social media.," The event challenges are web, mobile, AI, cyber security, and game dev.","Event Challenges will take place on Saturday, October 31st. A participant has to choose a specific field to participate in."
What are the rules of the event?,The rules of the event include the prohibition of cheating and the use of vulgar language., Cheating will disqualify the participant in order to preserve the integrity of the competition. Registration are open until the last day before the start of the challenges. Winners will be anounced and mentioned in our social media. There will be mentors and experts to provide hints and guidance throughout the competition.,Cheating will disqualify the participant in order to preserve the integrity of the competition
What happens if a participant cheats?,"HTTP code 502 from API (<html>
<head><title>502 Bad Gateway</title></head>
<body>
<center><h1>502 Bad Gateway</h1></center>
<hr><center>cloudflare</center>
</body>
</html>
)", The participant will be disqualified.,The participant will be disqualified in order to preserve the integrity of the competition.
How does the competition maintain its integrity?,"The competition maintains its integrity by ensuring that all participants adhere to the rules and guidelines, and by providing a fair and level playing field for all participants.", Cheating will disqualify the participant.,Judging criteria will be a scoring system taking into consideration the number and difficulty of solved challenges alongside the time needed for that.
What are the consequences of cheating?,Cheating in an event challenge will result in disqualification of the participant., Cheating will disqualify the participant.,"Sorry, the chatbot cannot answer this question"
What is the purpose of the leaderboard?,The purpose of the leaderboard is to display the rankings of participants in the Event Challenges., The leaderboard is used to track the progress of participants in the competition and to determine the winners at the end.,"Sorry, the chatbot cannot answer this question"
How will the leaderboard be updated?,The leaderboard for each Event Challenge will be updated in real-time and can be found on the Challenges platform.," The leaderboard will be updated throughout the competition, and will be frozen on the last phase.","Sorry, the chatbot cannot answer this question"
What criteria will be used to rank participants on the leaderboard?,Participants in the Event Challenges will be ranked on the leaderboard based on the criteria provided for each challenge., The number and difficulty of solved challenges alongside the time needed for that.,The judging criteria will be a scoring system taking into consideration the number and difficulty of solved challenges alongside the time needed for that Event Challenges.
How will the leaderboard be displayed?,The leaderboard for the Event Challenges will be displayed and updated throughout the competition., The leaderboard will be displayed on the Challenges platform and will be frozen on the last phase of the competition.,"Sorry, the chatbot cannot answer this question"
What is the last phase of the competition?,The last phase of the competition is a 10-day long competition., The last phase of the competition is when the leaderboard is frozen.,The last phase of the competition is the leaderboard phase
What kind of event challenges are available?,Event challenges are available and winners will be announced and mentioned in our social media.," The event challenges available are Web, Mobile, AI, Cyber Security, and Game Dev.","There are two types of challenges:
* - Online challenges
* - Hackathon"
