Question,Fine-tuning,API-based,Similarity Search
Who will be providing mentorship sessions at the Hackathon?,Mentors and experts will be providing mentorship sessions at the Hackathon., Experts in their fields will be providing mentorship sessions at the Hackathon.,A Hackathon is an event where developers come together to collaborate intensively on software projects.
What is the purpose of the event Hackathon?,The purpose of the event Hackathon is to bring together teams of 5 participants to collaborate and create innovative solutions to challenges in a limited amount of time.," The purpose of the event Hackathon is to provide participants with an opportunity to work on projects related to the theme of Smart Cities, with the help of mentors who are experts in their fields.","Yes, there will be mentorship sessions, our mentors will be available to assist you whenever you need guidance or have questions during the hackathon."
What is included in the Hackathon pack?,"The Hackathon pack includes a laptop charger, sleeping bag, and toiletries."," The Hackathon pack includes a laptop with its bag (charger/keyboard/mouse), phone and charger, headphones if needed, sweaters and one t-shirt, and a sleeping bag.",Experts in their fields
What type of laptop should I bring to the event?,You should bring your laptop to the event.," It depends on what type of tasks you will be doing at the event. If you are unsure, it is best to bring a laptop that is powerful enough to handle the tasks you will be doing.",The mentors will be experts in their fields.
Do I need to bring my own headphones to the event?,"Yes, you need to bring your own headphones to the event."," Yes, you need to bring your own headphones if you need to listen to music.","Yes, there will be mentors available to assist you whenever you need guidance or have questions during the hackathon."
